{
  "ack_id": "ACK-OBJ-20260221-003-codex",
  "objective_id": "OBJ-20260221-003",
  "responder": "codex",
  "status": "completed",
  "updated_at": "2026-02-21T20:10:00Z",
  "summary": "Read cascade and tesla references in full, synthesized Weaver staging trio, and prepared review-ready activation package.",
  "files_changed": [
    "QSOP/weaver/references/cascade_reference.yaml",
    "QSOP/weaver/references/tesla_reference.yaml",
    "QSOP/weaver/staging/the_weaver.seed.yaml",
    "QSOP/weaver/staging/the_weaver.contract.yaml",
    "QSOP/weaver/staging/the_loom_ledger_schema.yaml",
    "QSOP/weaver/staging/README.md",
    "QSOP/mail/objectives/OBJ-20260221-003.json",
    "QSOP/mail/acks/ACK-OBJ-20260221-003-codex.json"
  ],
  "verification": [
    {
      "command": "python QSOP/tools/validate_packets.py",
      "result": "pass"
    },
    {
      "command": "python QSOP/tools/run_all.py --pending-ack-sla-hours 24 --in-progress-sla-hours 48",
      "result": "pass"
    }
  ],
  "risks": [
    "Staging trio not yet promoted to primary Weaver files pending Antigravity review."
  ]
}
