{
  "ack_id": "ACK-OBJ-20260221-002-codex-02",
  "objective_id": "OBJ-20260221-002",
  "responder": "codex",
  "status": "blocked",
  "updated_at": "2026-02-21T02:20:00Z",
  "summary": "Blocked on sequencing checks while preparing packet transitions.",
  "files_changed": [],
  "verification": [],
  "risks": [
    "Transition ordering can invalidate metric interpretation if timestamps are incorrect."
  ]
}
