{
  "ack_id": "ACK-OBJ-20260221-002-codex-07",
  "objective_id": "OBJ-20260221-002",
  "responder": "codex",
  "status": "completed",
  "updated_at": "2026-02-21T03:40:00Z",
  "summary": "Reopened path resolved; objective completed with explicit reopen history.",
  "files_changed": [
    "QSOP/mail/acks/ACK-OBJ-20260221-002-codex-06.json",
    "QSOP/mail/acks/ACK-OBJ-20260221-002-codex-07.json"
  ],
  "verification": [
    {
      "command": "python QSOP/tools/run_all.py --pending-ack-sla-hours 24 --in-progress-sla-hours 48",
      "result": "pass"
    }
  ],
  "risks": []
}
