{
  "ack_id": "ACK-OBJ-20260221-002-codex-06",
  "objective_id": "OBJ-20260221-002",
  "responder": "codex",
  "status": "in_progress",
  "updated_at": "2026-02-21T03:15:00Z",
  "summary": "Reopened objective back in progress for final correction pass.",
  "files_changed": [
    "QSOP/mail/acks/ACK-OBJ-20260221-002-codex-05.json"
  ],
  "verification": [],
  "risks": []
}
