{
  "ack_id": "ACK-OBJ-20260221-002-codex-03",
  "objective_id": "OBJ-20260221-002",
  "responder": "codex",
  "status": "in_progress",
  "updated_at": "2026-02-21T02:35:00Z",
  "summary": "Recovered from block and resumed implementation.",
  "files_changed": [
    "QSOP/mail/objectives/OBJ-20260221-002.json"
  ],
  "verification": [],
  "risks": []
}
